name,domain,difficulty,tags,full_name,application_id,application_context,task_title,summarized_goal,persona_background_header,persona_background,task_goal_label,greeting,fallback,bot_name,local_compose,capabilities,base_url_env,sidecar_host,persona_role,chatbot_role,ps_defaultMode,ps_dimensionFilters,ps_stratifyFields,ps_sampleSize,persona_exposure_fields,context_description,rules
education-ai-tutoring_chatbot,education,medium,"education, tutoring, edtech",application/education-ai-tutoring-chatbot,ai_tutor_chat,education_tutoring,AI Tutoring Chatbot,Get help understanding an academic concept from an AI tutoring chatbot that adapts to your learning style and knowledge level.,Your Tutoring Scenario,You are a learner using an AI tutoring chatbot to understand a topic concept. Your assigned learner profile defines your actual mastery level confidence learning style and emotional state. Do not state your profile directly -- behave naturally.,Get a concept explanation adapted to your level,Hello! I'm your AI tutoring assistant. What topic or concept would you like help with today?,I'm not sure I can help with that topic. Could you tell me more about what you're trying to learn or what subject you're studying?,AI Tutor,,,,,customer,assistant,random,{},,6,[],,
legal-tenant-rights_chatbot,legal,medium,"legal, tenant-rights, housing",application/legal-tenant-rights-chatbot,legal_info_chat,legal_tenant_support,Tenant Rights Legal Information Chatbot,Get accurate information about your tenant rights and understand your legal options for a housing problem.,Your Legal Scenario,You are a tenant with a housing problem in a specific jurisdiction. Describe your situation naturally -- the chatbot will explain the relevant rules. Do not assume you know the law.,Understand your tenant rights and options,Hello! I'm a legal information assistant focused on tenant rights. I can explain landlord-tenant laws but I cannot give legal advice. What housing situation are you dealing with?,I'm sorry I don't have information about that jurisdiction or situation. Please note that I can only provide legal information not legal advice. For specific legal representation please consult a licensed attorney.,Tenant Rights Assistant,,,,,customer,assistant,random,{},,6,[],,
travel-trip-change_chatbot,travel,medium,"travel, hospitality, bookings",application/travel-trip-change-chatbot,travel_booking_chat,travel_support,Travel Booking Change & Cancellation Chatbot,Get help changing or canceling a bundled trip itinerary and understand the fees and policies involved.,Your Travel Scenario,You are a traveler contacting the booking platform's support chat about a bundled trip you booked. Your profile defines your booking details and which leg(s) you want to change or cancel. Reveal your booking reference only when asked.,Get help with a trip change or cancellation,Hello! I'm your travel booking assistant. I can help with changing or canceling flights hotels and car rentals. Do you have a booking reference number?,I'm sorry I couldn't find a resolution for that request. Please check your booking details and try again or contact customer support for complex cases.,Travel Support Assistant,,,,,customer,assistant,random,{},,6,[],,
real-estate-rental_chatbot,real-estate,medium,"real-estate, rental, property",application/real-estate-rental-chatbot,rental_screener_chat,rental_eligibility,Rental Application Eligibility Chatbot,Get pre-screened for a rental property and understand whether you qualify based on the landlord's criteria.,Your Rental Scenario,You are a prospective tenant looking to rent an apartment. You know the address and listed rent but not the full landlord criteria. Reveal information only when asked.,Get a pre-screening assessment for a rental property,Hello! I'm your rental application assistant. I can help you understand whether a property might be a good fit. Which property are you interested in?,I'm sorry I don't have enough information to assess your eligibility. Could you provide more details about your situation or the property?,Rental Assistant,,,,,customer,assistant,random,{},,6,[],,
telecom-bill-dispute_chatbot,telecom,medium,"telecom, bill-dispute, customer-service",application/telecom-bill-dispute-chatbot,telecom_support_chat,telecom_billing,Telecom Bill Dispute & Plan Change Chatbot,Get help resolving a billing issue or changing your mobile plan with correct proration and fee calculations.,Your Telecom Scenario,You are a mobile phone customer contacting your carrier about a billing issue. Your profile defines your plan the charge you're disputing and what actually happened. Reveal account details only when asked.,Resolve a billing issue or plan change,Hello! I'm your telecom support assistant. I can help with billing questions plan changes and account issues. For security could you please provide your phone number?,I'm sorry I couldn't process that request. Please verify your account information and try again or visit a store for in-person assistance.,Telecom Support Assistant,,,,,customer,assistant,random,{},,6,[],,
insurance-claim-filing_chatbot,insurance,medium,"insurance, claims, coverage",application/insurance-claim-filing-chatbot,insurance_claim_chat,insurance_claims,Insurance Claim Filing & Coverage Chatbot,Get help filing an insurance claim and understand your coverage deductible and out-of-pocket costs.,Your Insurance Scenario,You are a policyholder filing an insurance claim for an incident. Your profile defines your policy coverage and available evidence. Reveal your policy number only when asked.,File an insurance claim and understand coverage,Hello! I'm your claims assistant. I'm sorry to hear about your incident. Let me help you file a claim. Could you start by telling me what happened and providing your policy number?,I'm sorry I cannot process this claim with the information provided. Please note that I cannot approve claims or guarantee payouts -- only an adjuster can make final decisions.,Claims Assistant,,,,,customer,assistant,random,{},,6,[],,
